<?xml version="1.0" encoding="utf-8"?>
<MM2 xmlns="http://www.met.no/schema/metamod/MM2" xmlns:xsi="http://www.w3.org/2001/XMLSchema-instance" xsi:schemaLocation="http://www.met.no/schema/metamod/MM2 https://wiki.met.no/_media/metamod/mm2.xsd">
<metadata xmlns="http://www.met.no/schema/metamod/MM2" name="variable">sea_water_pressure</metadata><metadata xmlns="http://www.met.no/schema/metamod/MM2" name="variable">sea_water_temperature</metadata><metadata xmlns="http://www.met.no/schema/metamod/MM2" name="variable">sea_water_speed</metadata><metadata xmlns="http://www.met.no/schema/metamod/MM2" name="variable">direction_of_sea_water_velocity</metadata><metadata xmlns="http://www.met.no/schema/metamod/MM2" name="variable">Oceans &gt; Ocean Circulation &gt; Ocean Currents Oceans &gt; Ocean Temperature &gt; Water Temperature Oceans &gt; Salinity/Density &gt; Salinity Oceans &gt; Ocean Pressure &gt; Water Pressure &gt; HIDDEN</metadata><metadata xmlns="http://www.met.no/schema/metamod/MM2" name="variable">depth</metadata><metadata xmlns="http://www.met.no/schema/metamod/MM2" name="variable">sea_water_salinity</metadata><metadata xmlns="http://www.met.no/schema/metamod/MM2" name="area">Nordic Seas</metadata><metadata xmlns="http://www.met.no/schema/metamod/MM2" name="contact">Kjell.Orvik@gfi.uib.no</metadata><metadata xmlns="http://www.met.no/schema/metamod/MM2" name="topiccategory">oceans</metadata><metadata xmlns="http://www.met.no/schema/metamod/MM2" name="PI_name">Kjell Arild Orvik</metadata><metadata xmlns="http://www.met.no/schema/metamod/MM2" name="keywords">ocean current temperature salinity pressure</metadata><metadata xmlns="http://www.met.no/schema/metamod/MM2" name="datacollection_period_from">2005-12-01</metadata><metadata xmlns="http://www.met.no/schema/metamod/MM2" name="activity_type">Moored instrument</metadata><metadata xmlns="http://www.met.no/schema/metamod/MM2" name="project_name">DAMOCLES</metadata><metadata xmlns="http://www.met.no/schema/metamod/MM2" name="Conventions">CF-1.0</metadata><metadata xmlns="http://www.met.no/schema/metamod/MM2" name="Platform_name">Svinøy S1 mooring</metadata><metadata xmlns="http://www.met.no/schema/metamod/MM2" name="history">2008-11-26 Created</metadata><metadata xmlns="http://www.met.no/schema/metamod/MM2" name="distribution_statement">Restricted to Damocles</metadata><metadata xmlns="http://www.met.no/schema/metamod/MM2" name="datacollection_period_to">2008-10-07</metadata><metadata xmlns="http://www.met.no/schema/metamod/MM2" name="abstract">Mooring observing current, temperature, salinity and pressure. The mooring is 
named S1 in the Svinøy section and positioned at 62o 49.33 N, 4o 17.41 E. The 
depth is 500m and the dataset contains hourly records (raw data) from 100m and 
300m. Time is specified in UTC. </metadata><metadata xmlns="http://www.met.no/schema/metamod/MM2" name="title">Svinøy S1 mooring</metadata><metadata xmlns="http://www.met.no/schema/metamod/MM2" name="bounding_box">4.2901667,62.8221667,4.2901667,62.8221667</metadata><metadata xmlns="http://www.met.no/schema/metamod/MM2" name="institution">UiB University of Bergen</metadata><metadata xmlns="http://www.met.no/schema/metamod/MM2" name="product_name">Svinøy S1 mooring 100m and 300m</metadata><metadata xmlns="http://www.met.no/schema/metamod/MM2" name="dataref">http://thredds.met.no/thredds/catalog/data/UiB/svinoy-mooring/catalog.html?dataset=UiB/svinoy-mooring/svinoy-mooring_S1-300m.nc</metadata></MM2>
