<?xml version="1.0" encoding="iso8859-1"?>
<MM2 xmlns="http://www.met.no/schema/metamod/MM2" xmlns:ns1="http://www.w3.org/2001/XMLSchema-instance" ns1:schemaLocation="http://www.met.no/schema/metamod/MM2 https://wiki.met.no/_media/metamod/mm2.xsd">
  <metadata name="datacollection_period_from">2007-07-29</metadata>
  <metadata name="datacollection_period_to">2007-10-06</metadata>
  <metadata name="bounding_box">-135.,72.,26.,89.</metadata>
  <metadata name="dataref">http://thredds.met.no/thredds/catalog/data/AWI/ark22/</metadata>
  <metadata name="area">Arctic Ocean</metadata>
  <metadata name="contact">Andreas.Wisotzki@awi.de</metadata>
  <metadata name="topiccategory">oceans</metadata>
  <metadata name="PI_name">Andreas Wisotzki</metadata>
  <metadata name="Platform_name">R/V Polarstern</metadata>
  <metadata name="distribution_statement">Data restriction: for DAMOCLES partners only</metadata>
  <metadata name="software_version">Seabird: SeasaveWin32, Version 5.37d, SBE Data Processing, Version 5.37e</metadata>
  <metadata name="institution">AWI Alfred Wegener Institute for Polar and Marine Research</metadata>
  <metadata name="product_name">CTD temperature, salinity, dissolved oxygen and light transmission at 191 stations in the Arctic Ocean</metadata>
  <metadata name="abstract">
CTD temperature, salinity, dissolved oxygen and light transmission at 191 stations in the Arctic Ocean
   </metadata>
  <metadata name="variable">sea_water_dissolved_oxygen</metadata>
  <metadata name="variable">sea_water_temperature</metadata>
  <metadata name="variable">sea_water_light_transmission</metadata>
  <metadata name="variable">sea_water_salinity</metadata>
</MM2>
