<?xml version="1.0" encoding="iso8859-1"?>
<MM2 xmlns="http://www.met.no/schema/metamod/MM2" xmlns:ns1="http://www.w3.org/2001/XMLSchema-instance" ns1:schemaLocation="http://www.met.no/schema/metamod/MM2 https://wiki.met.no/_media/metamod/mm2.xsd">
  <metadata name="datacollection_period_from">2005-07-01</metadata>
  <metadata name="datacollection_period_to">2009-09-01</metadata>
  <metadata name="institution">AWI Alfred Wegener Institute for Polar and Marine Research</metadata>
  <metadata name="contact">abeszczynska@awi-bremerhaven.de</metadata>
  <metadata name="dataref">AWI-1 (planned activity)</metadata>
  <metadata name="activity_type">Cruise</metadata>
  <metadata name="variable">Oceans &gt; Ocean Optics &gt; Attenuation/Transmission &gt; HIDDEN</metadata>
  <metadata name="variable">Oceans &gt; Ocean Pressure &gt; Water Pressure &gt; HIDDEN</metadata>
  <metadata name="variable">Oceans &gt; Ocean Temperature &gt; Potential Temperature &gt; HIDDEN</metadata>
  <metadata name="variable">Oceans &gt; Salinity/Density &gt; Conductivity &gt; HIDDEN</metadata>
  <metadata name="variable">Oceans &gt; Salinity/Density &gt; Potential Density &gt; HIDDEN</metadata>
  <metadata name="variable">Oceans &gt; Salinity/Density &gt; Salinity &gt; HIDDEN</metadata>
  <metadata name="area">Fram Strait</metadata>
  <metadata name="abstract">
CTD section across Fram Strait at 78deg50min N (along the moored array) performed on annual basis in
summer/autumn
   </metadata>
</MM2>
