<?xml version="1.0" encoding="utf-8"?>
<MM2 xmlns="http://www.met.no/schema/metamod/MM2" xmlns:xsi="http://www.w3.org/2001/XMLSchema-instance" xsi:schemaLocation="http://www.met.no/schema/metamod/MM2 https://wiki.met.no/_media/metamod/mm2.xsd">
<metadata xmlns="http://www.met.no/schema/metamod/MM2" name="variable">sea_water_pressure</metadata><metadata xmlns="http://www.met.no/schema/metamod/MM2" name="variable">Oceans &gt; Ocean Temperature &gt; Water Temperature &gt; HIDDEN</metadata><metadata xmlns="http://www.met.no/schema/metamod/MM2" name="variable">Oceans &gt; Salinity/Density &gt; Salinity &gt; HIDDEN</metadata><metadata xmlns="http://www.met.no/schema/metamod/MM2" name="variable">sea_water_electrical_conductivity</metadata><metadata xmlns="http://www.met.no/schema/metamod/MM2" name="variable">Oceans &gt; Ocean Pressure &gt; Water Pressure &gt; HIDDEN</metadata><metadata xmlns="http://www.met.no/schema/metamod/MM2" name="variable">sea_water_salinity</metadata><metadata xmlns="http://www.met.no/schema/metamod/MM2" name="area">Arctic Ocean</metadata><metadata xmlns="http://www.met.no/schema/metamod/MM2" name="contact">itp@whoi.edu</metadata><metadata xmlns="http://www.met.no/schema/metamod/MM2" name="topiccategory">oceans</metadata><metadata xmlns="http://www.met.no/schema/metamod/MM2" name="PI_name">Not available</metadata><metadata xmlns="http://www.met.no/schema/metamod/MM2" name="keywords">pressure temperature salinity</metadata><metadata xmlns="http://www.met.no/schema/metamod/MM2" name="datacollection_period_from">2007-10-21</metadata><metadata xmlns="http://www.met.no/schema/metamod/MM2" name="activity_type">Float</metadata><metadata xmlns="http://www.met.no/schema/metamod/MM2" name="project_name">Damocles</metadata><metadata xmlns="http://www.met.no/schema/metamod/MM2" name="Conventions">CF-1.0</metadata><metadata xmlns="http://www.met.no/schema/metamod/MM2" name="Platform_name">ITP 17</metadata><metadata xmlns="http://www.met.no/schema/metamod/MM2" name="history">2009-03-13 creation</metadata><metadata xmlns="http://www.met.no/schema/metamod/MM2" name="distribution_statement">Free</metadata><metadata xmlns="http://www.met.no/schema/metamod/MM2" name="datacollection_period_to">2007-10-22</metadata><metadata xmlns="http://www.met.no/schema/metamod/MM2" name="abstract">The Ice-Tethered Profiler data were collected and made available by the 
Ice-Tethered Profiler Program based at the Woods Hole Oceanographic Institution 
(http://www.whoi.edu/itp). ITP data are similar to CTD data, but are collected 
from buoys frozen in the sea ice. </metadata><metadata xmlns="http://www.met.no/schema/metamod/MM2" name="title">ITP 17 Profile</metadata><metadata xmlns="http://www.met.no/schema/metamod/MM2" name="bounding_box">84.4166,87.4094,84.4166,87.4094</metadata><metadata xmlns="http://www.met.no/schema/metamod/MM2" name="institution">Woods Hole Oceanographic Institute</metadata><metadata xmlns="http://www.met.no/schema/metamod/MM2" name="product_name">ITP profile</metadata><metadata xmlns="http://www.met.no/schema/metamod/MM2" name="dataref">http://thredds.met.no/thredds/catalog/data/met.no/itp17/catalog.html?dataset=met.no/itp17/itp17_itp17grd0229.nc</metadata></MM2>
