<?xml version="1.0" encoding="utf-8"?>
<MM2 xmlns="http://www.met.no/schema/metamod/MM2" xmlns:xsi="http://www.w3.org/2001/XMLSchema-instance" xsi:schemaLocation="http://www.met.no/schema/metamod/MM2 https://wiki.met.no/_media/metamod/mm2.xsd">
<metadata xmlns="http://www.met.no/schema/metamod/MM2" name="variable">sea_water_temperature</metadata><metadata xmlns="http://www.met.no/schema/metamod/MM2" name="variable">sea_water_pressure</metadata><metadata xmlns="http://www.met.no/schema/metamod/MM2" name="variable">sea_water_speed</metadata><metadata xmlns="http://www.met.no/schema/metamod/MM2" name="variable">direction_of_sea_water_velocity</metadata><metadata xmlns="http://www.met.no/schema/metamod/MM2" name="variable">depth</metadata><metadata xmlns="http://www.met.no/schema/metamod/MM2" name="variable">eastward_sea_water_velocity</metadata><metadata xmlns="http://www.met.no/schema/metamod/MM2" name="variable">sea_water_salinity</metadata><metadata xmlns="http://www.met.no/schema/metamod/MM2" name="variable">northward_sea_water_velocity</metadata><metadata xmlns="http://www.met.no/schema/metamod/MM2" name="area">Fram Strait</metadata><metadata xmlns="http://www.met.no/schema/metamod/MM2" name="contact">Agnieszka.Beszczynska-Moeller@awi.de</metadata><metadata xmlns="http://www.met.no/schema/metamod/MM2" name="topiccategory">oceans</metadata><metadata xmlns="http://www.met.no/schema/metamod/MM2" name="PI_name">Agnieszka Beszczynska-Moeller</metadata><metadata xmlns="http://www.met.no/schema/metamod/MM2" name="keywords">moorings Fram Strait current meters</metadata><metadata xmlns="http://www.met.no/schema/metamod/MM2" name="datacollection_period_from">2006-08-28</metadata><metadata xmlns="http://www.met.no/schema/metamod/MM2" name="activity_type">Moored instrument</metadata><metadata xmlns="http://www.met.no/schema/metamod/MM2" name="project_name">DAMOCLES IP</metadata><metadata xmlns="http://www.met.no/schema/metamod/MM2" name="Conventions">CF-1.0</metadata><metadata xmlns="http://www.met.no/schema/metamod/MM2" name="history">2009-01-21 creation</metadata><metadata xmlns="http://www.met.no/schema/metamod/MM2" name="distribution_statement">Restricted to Damocles</metadata><metadata xmlns="http://www.met.no/schema/metamod/MM2" name="datacollection_period_to">2007-09-11</metadata><metadata xmlns="http://www.met.no/schema/metamod/MM2" name="abstract">Array of 12 deep moorings across Fram Strait at 78deg50min N maintained by AWI </metadata><metadata xmlns="http://www.met.no/schema/metamod/MM2" name="title">Fram Strat moored array data</metadata><metadata xmlns="http://www.met.no/schema/metamod/MM2" name="bounding_box">5.02233333333333,78.8305,5.02233333333333,78.8305</metadata><metadata xmlns="http://www.met.no/schema/metamod/MM2" name="product_name">Data from moored instrument</metadata><metadata xmlns="http://www.met.no/schema/metamod/MM2" name="dataref">http://thredds.met.no/thredds/catalog/data/AWI/FSmoorings-2006-2007/catalog.html?dataset=AWI/FSmoorings-2006-2007/FSmoorings-2006-2007_F6-10_2638m.nc</metadata><metadata xmlns="http://www.met.no/schema/metamod/MM2" name="institution">Alfred Wegener Institute for Polar and Marine Research, Bremerhaven, Germany</metadata></MM2>
