<?xml version="1.0" encoding="utf-8"?>
<MM2 xmlns="http://www.met.no/schema/metamod/MM2" xmlns:xsi="http://www.w3.org/2001/XMLSchema-instance" xsi:schemaLocation="http://www.met.no/schema/metamod/MM2 https://wiki.met.no/_media/metamod/mm2.xsd">
<metadata xmlns="http://www.met.no/schema/metamod/MM2" name="variable">sea_water_pressure</metadata><metadata xmlns="http://www.met.no/schema/metamod/MM2" name="variable">sea_water_temperature</metadata><metadata xmlns="http://www.met.no/schema/metamod/MM2" name="variable">sea_water_electrical_conductivity</metadata><metadata xmlns="http://www.met.no/schema/metamod/MM2" name="variable">sea_water_salinity</metadata><metadata xmlns="http://www.met.no/schema/metamod/MM2" name="area">Barents Sea</metadata><metadata xmlns="http://www.met.no/schema/metamod/MM2" name="area">Greenland Sea</metadata><metadata xmlns="http://www.met.no/schema/metamod/MM2" name="contact">ilona_g@iopan.gda.pl</metadata><metadata xmlns="http://www.met.no/schema/metamod/MM2" name="topiccategory">oceans</metadata><metadata xmlns="http://www.met.no/schema/metamod/MM2" name="PI_name">Ilona Goszczko</metadata><metadata xmlns="http://www.met.no/schema/metamod/MM2" name="product_version">1.0</metadata><metadata xmlns="http://www.met.no/schema/metamod/MM2" name="operational_status">operational</metadata><metadata xmlns="http://www.met.no/schema/metamod/MM2" name="keywords">Oceanography Pressure Temperature Coductivity Salinity</metadata><metadata xmlns="http://www.met.no/schema/metamod/MM2" name="references">http://seabird.com</metadata><metadata xmlns="http://www.met.no/schema/metamod/MM2" name="datacollection_period_from">2007-06-19</metadata><metadata xmlns="http://www.met.no/schema/metamod/MM2" name="activity_type">Cruise</metadata><metadata xmlns="http://www.met.no/schema/metamod/MM2" name="project_name">Damocles</metadata><metadata xmlns="http://www.met.no/schema/metamod/MM2" name="project_name">AREX 2007</metadata><metadata xmlns="http://www.met.no/schema/metamod/MM2" name="history">2007-07-22 creation</metadata><metadata xmlns="http://www.met.no/schema/metamod/MM2" name="distribution_statement">Restricted to Damocles</metadata><metadata xmlns="http://www.met.no/schema/metamod/MM2" name="quality_index">1</metadata><metadata xmlns="http://www.met.no/schema/metamod/MM2" name="software_version">CTD Seabird SBE911plus, Seasave Win32 V 7.12</metadata><metadata xmlns="http://www.met.no/schema/metamod/MM2" name="datacollection_period_to">2007-07-22</metadata><metadata xmlns="http://www.met.no/schema/metamod/MM2" name="title">IO PAS CTD data file</metadata><metadata xmlns="http://www.met.no/schema/metamod/MM2" name="abstract">IO PAS CTD data file from Arctic Cruise with R/V Oceania performed in summer 
2007 </metadata><metadata xmlns="http://www.met.no/schema/metamod/MM2" name="bounding_box">20.004,70.5,0.044,79.831</metadata><metadata xmlns="http://www.met.no/schema/metamod/MM2" name="institution">IOPAN Instytut Oceanologii, Polska Akademia Nauk</metadata><metadata xmlns="http://www.met.no/schema/metamod/MM2" name="product_name">oceania_ctd_ar07</metadata><metadata xmlns="http://www.met.no/schema/metamod/MM2" name="dataref">http://thredds.met.no/thredds/catalog/data/IOPAS/oceania/catalog.html?dataset=IOPAS/oceania/oceania_ctd_AR07_051.nc</metadata></MM2>
