<?xml version="1.0" encoding="utf-8"?>
<MM2 xmlns="http://www.met.no/schema/metamod/MM2" xmlns:xsi="http://www.w3.org/2001/XMLSchema-instance" xsi:schemaLocation="http://www.met.no/schema/metamod/MM2 https://wiki.met.no/_media/metamod/mm2.xsd">
<metadata xmlns="http://www.met.no/schema/metamod/MM2" name="variable">sea_water_temperature</metadata><metadata xmlns="http://www.met.no/schema/metamod/MM2" name="variable">sea_water_pressure</metadata><metadata xmlns="http://www.met.no/schema/metamod/MM2" name="variable">sea_water_sigma_theta</metadata><metadata xmlns="http://www.met.no/schema/metamod/MM2" name="variable">sea_water_electrical_conductivity</metadata><metadata xmlns="http://www.met.no/schema/metamod/MM2" name="variable">sea_water_potential_temperature</metadata><metadata xmlns="http://www.met.no/schema/metamod/MM2" name="variable">sea_water_salinity</metadata><metadata xmlns="http://www.met.no/schema/metamod/MM2" name="area">Greenland Sea</metadata><metadata xmlns="http://www.met.no/schema/metamod/MM2" name="contact">ocl@iopan.gda.pl</metadata><metadata xmlns="http://www.met.no/schema/metamod/MM2" name="topiccategory">oceans</metadata><metadata xmlns="http://www.met.no/schema/metamod/MM2" name="PI_name">Ocean Circulation Laboratory</metadata><metadata xmlns="http://www.met.no/schema/metamod/MM2" name="keywords">Salinity/Density</metadata><metadata xmlns="http://www.met.no/schema/metamod/MM2" name="keywords">Ocean Temperature</metadata><metadata xmlns="http://www.met.no/schema/metamod/MM2" name="keywords">Greenland Sea</metadata><metadata xmlns="http://www.met.no/schema/metamod/MM2" name="Conventions">CF1.0</metadata><metadata xmlns="http://www.met.no/schema/metamod/MM2" name="Platform_name">R/V Oceania</metadata><metadata xmlns="http://www.met.no/schema/metamod/MM2" name="distribution_statement">Data restrictions: for DAMOCLES partners only</metadata><metadata xmlns="http://www.met.no/schema/metamod/MM2" name="abstract">IO PAS CTD data file from Arctic Cruise with R/V Oceania performed in summer 
2006 </metadata><metadata xmlns="http://www.met.no/schema/metamod/MM2" name="title">IO PAS CTD data file</metadata><metadata xmlns="http://www.met.no/schema/metamod/MM2" name="product_name">oceania_ctd_ar06_145.nc</metadata><metadata xmlns="http://www.met.no/schema/metamod/MM2" name="dataref">http://thredds.met.no/thredds/catalog/data/IOPAS/ocCTDar06/catalog.html?dataset=IOPAS/ocCTDar06/ocCTDar06_145.nc</metadata><metadata xmlns="http://www.met.no/schema/metamod/MM2" name="institution">Institute of Oceanology, Polish Academy of Sciences</metadata></MM2>
