<?xml version="1.0" encoding="iso8859-1"?>
<MM2 xmlns="http://www.met.no/schema/metamod/MM2" xmlns:ns1="http://www.w3.org/2001/XMLSchema-instance" ns1:schemaLocation="http://www.met.no/schema/metamod/MM2 https://wiki.met.no/_media/metamod/mm2.xsd">
  <metadata name="datacollection_period_from">2006-04-01</metadata>
  <metadata name="datacollection_period_to">2009-11-30</metadata>
  <metadata name="institution">FIMR Finnish Institute of Marine Research</metadata>
  <metadata name="contact">rudels@fimr.fi</metadata>
  <metadata name="dataref">FIMR-2 (planned activity)</metadata>
  <metadata name="activity_type">Cruise</metadata>
  <metadata name="variable">Oceans &gt; Ocean Circulation &gt; Advection &gt; HIDDEN</metadata>
  <metadata name="variable">Oceans &gt; Ocean Circulation &gt; Convection &gt; HIDDEN</metadata>
  <metadata name="variable">Oceans &gt; Ocean Circulation &gt; Diffusion &gt; HIDDEN</metadata>
  <metadata name="variable">Oceans &gt; Ocean Circulation &gt; Eddies &gt; HIDDEN</metadata>
  <metadata name="variable">Oceans &gt; Ocean Circulation &gt; Fresh Water Flux &gt; HIDDEN</metadata>
  <metadata name="variable">Oceans &gt; Ocean Circulation &gt; Fronts &gt; HIDDEN</metadata>
  <metadata name="variable">Oceans &gt; Ocean Circulation &gt; Gyres &gt; HIDDEN</metadata>
  <metadata name="variable">Oceans &gt; Ocean Circulation &gt; Ocean Currents &gt; HIDDEN</metadata>
  <metadata name="variable">Oceans &gt; Ocean Circulation &gt; Ocean Mixed Layer &gt; HIDDEN</metadata>
  <metadata name="variable">Oceans &gt; Ocean Circulation &gt; Thermohaline Circulation &gt; HIDDEN</metadata>
  <metadata name="variable">Oceans &gt; Ocean Circulation &gt; Turbulence &gt; HIDDEN</metadata>
  <metadata name="variable">Oceans &gt; Ocean Circulation &gt; Upwelling/Downwelling &gt; HIDDEN</metadata>
  <metadata name="variable">Oceans &gt; Ocean Circulation &gt; Vorticity &gt; HIDDEN</metadata>
  <metadata name="variable">Oceans &gt; Ocean Circulation &gt; Water Masses &gt; HIDDEN</metadata>
  <metadata name="variable">Oceans &gt; Ocean Circulation &gt; Wind-driven Circulation &gt; HIDDEN</metadata>
  <metadata name="variable">Oceans &gt; Ocean Heat Budget &gt; Advection &gt; HIDDEN</metadata>
  <metadata name="variable">Oceans &gt; Ocean Heat Budget &gt; Convection &gt; HIDDEN</metadata>
  <metadata name="variable">Oceans &gt; Ocean Heat Budget &gt; Diffusion &gt; HIDDEN</metadata>
  <metadata name="variable">Oceans &gt; Ocean Heat Budget &gt; Evaporation &gt; HIDDEN</metadata>
  <metadata name="variable">Oceans &gt; Ocean Heat Budget &gt; Heat Flux &gt; HIDDEN</metadata>
  <metadata name="variable">Oceans &gt; Ocean Temperature &gt; Ocean Mixed Layer &gt; HIDDEN</metadata>
  <metadata name="variable">Oceans &gt; Ocean Temperature &gt; Thermocline &gt; HIDDEN</metadata>
  <metadata name="variable">Oceans &gt; Salinity/Density &gt; Halocline &gt; HIDDEN</metadata>
  <metadata name="variable">Oceans &gt; Salinity/Density &gt; Potential Density &gt; HIDDEN</metadata>
  <metadata name="variable">Oceans &gt; Salinity/Density &gt; Pycnocline &gt; HIDDEN</metadata>
  <metadata name="variable">Cryosphere &gt; Sea Ice &gt; Polynyas &gt; HIDDEN</metadata>
  <metadata name="area">Greenland Sea</metadata>
  <metadata name="area">Iceland Sea</metadata>
  <metadata name="area">Norwegian Sea</metadata>
  <metadata name="area">Fram Strait</metadata>
  <metadata name="area">Denmark Strait</metadata>
  <metadata name="area">Central Arctic</metadata>
  <metadata name="abstract">
Aranda, Oden
   </metadata>
</MM2>
