<?xml version="1.0" encoding="iso8859-1"?>
<MM2 xmlns="http://www.met.no/schema/metamod/MM2" xmlns:ns1="http://www.w3.org/2001/XMLSchema-instance" ns1:schemaLocation="http://www.met.no/schema/metamod/MM2 https://wiki.met.no/_media/metamod/mm2.xsd">
  <metadata name="datacollection_period_from">2008-08-17</metadata>
  <metadata name="datacollection_period_to">2008-09-18</metadata>
  <metadata name="bounding_box">179.9058,69.7082,-176.5038,77.1788</metadata>
  <metadata name="variable">sea_water_pressure</metadata>
  <metadata name="variable">ocean chemistry &gt; HIDDEN</metadata>
  <metadata name="variable">sea_water_salinity</metadata>
  <metadata name="area">Arctic Ocean</metadata>
  <metadata name="contact">leifand@chem.gu.se</metadata>
  <metadata name="topiccategory">oceans</metadata>
  <metadata name="PI_name">Leif Anderson</metadata>
  <metadata name="keywords">cruise</metadata>
  <metadata name="keywords">Arctic Ocean</metadata>
  <metadata name="activity_type">Cruise</metadata>
  <metadata name="project_name">ISSS08</metadata>
  <metadata name="Conventions">CF-1.0</metadata>
  <metadata name="Platform_name">R/V Jakov Smirnitskyi</metadata>
  <metadata name="history">created: 2008-12-04 version 1.0</metadata>
  <metadata name="distribution_statement">Restricted to Damocles</metadata>
  <metadata name="abstract">
This data was collected during the International Siberian Shelf Study 2008 
(ISSS08) onboard the Russian research vessel Jakov Smirnitskiy. These data have 
been through a preliminary QC and questionable data have been removed. 
   </metadata>
  <metadata name="title">Carbon sample data from ISSS08 in the Arctic Ocean</metadata>
  <metadata name="institution">UGOT Göteborg University Department of Oceanography - Earth Sciences Centre</metadata>
  <metadata name="product_name">ISSS08 carbon data</metadata>
  <metadata name="dataref">http://damocles.met.no:8080/thredds/catalog/data/UGOT/UGOT-data/</metadata>
</MM2>
