<?xml version="1.0" encoding="utf-8"?>
<MM2 xmlns="http://www.met.no/schema/metamod/MM2" xmlns:xsi="http://www.w3.org/2001/XMLSchema-instance" xsi:schemaLocation="http://www.met.no/schema/metamod/MM2 https://wiki.met.no/_media/metamod/mm2.xsd">
<metadata xmlns="http://www.met.no/schema/metamod/MM2" name="variable">sea_water_temperature</metadata><metadata xmlns="http://www.met.no/schema/metamod/MM2" name="variable">number_of_profile_samples</metadata><metadata xmlns="http://www.met.no/schema/metamod/MM2" name="variable">depth</metadata><metadata xmlns="http://www.met.no/schema/metamod/MM2" name="variable">sea_water_salinity</metadata><metadata xmlns="http://www.met.no/schema/metamod/MM2" name="area">Arctic Ocean</metadata><metadata xmlns="http://www.met.no/schema/metamod/MM2" name="contact">sacha.fouchard@ipev.fr</metadata><metadata xmlns="http://www.met.no/schema/metamod/MM2" name="topiccategory">oceans</metadata><metadata xmlns="http://www.met.no/schema/metamod/MM2" name="PI_name">Sacha Fouchard</metadata><metadata xmlns="http://www.met.no/schema/metamod/MM2" name="keywords">Sea Water Salinity Temperature Depth Ocean </metadata><metadata xmlns="http://www.met.no/schema/metamod/MM2" name="datacollection_period_from">2007-04-26</metadata><metadata xmlns="http://www.met.no/schema/metamod/MM2" name="activity_type">Ice station</metadata><metadata xmlns="http://www.met.no/schema/metamod/MM2" name="project_name">Damocles</metadata><metadata xmlns="http://www.met.no/schema/metamod/MM2" name="Conventions">CF-1.0</metadata><metadata xmlns="http://www.met.no/schema/metamod/MM2" name="Platform_name">300124010704000</metadata><metadata xmlns="http://www.met.no/schema/metamod/MM2" name="history">2009-02-24 creation</metadata><metadata xmlns="http://www.met.no/schema/metamod/MM2" name="distribution_statement">Restricted to Damocles</metadata><metadata xmlns="http://www.met.no/schema/metamod/MM2" name="datacollection_period_to">2008-02-13</metadata><metadata xmlns="http://www.met.no/schema/metamod/MM2" name="abstract">CTD value packet from POPS 300124010704000 </metadata><metadata xmlns="http://www.met.no/schema/metamod/MM2" name="title">POPS 300124010704000 Values</metadata><metadata xmlns="http://www.met.no/schema/metamod/MM2" name="bounding_box">-12.1008,76.085281,133.334702,87.260399</metadata><metadata xmlns="http://www.met.no/schema/metamod/MM2" name="institution">IPEV Institut Polaire Fran√ßais - Paul Emile Victor</metadata><metadata xmlns="http://www.met.no/schema/metamod/MM2" name="product_name">CTD dataset</metadata><metadata xmlns="http://www.met.no/schema/metamod/MM2" name="dataref">http://damocles.met.no:8080/thredds/catalog/data/met.no/pops/catalog.html?dataset=met.no/pops/pops_300124010704000-val.nc</metadata></MM2>
