<?xml version="1.0" encoding="utf-8"?>
<MM2 xmlns="http://www.met.no/schema/metamod/MM2" xmlns:xsi="http://www.w3.org/2001/XMLSchema-instance" xsi:schemaLocation="http://www.met.no/schema/metamod/MM2 https://wiki.met.no/_media/metamod/mm2.xsd">
<metadata xmlns="http://www.met.no/schema/metamod/MM2" name="area">Arctic Ocean</metadata><metadata xmlns="http://www.met.no/schema/metamod/MM2" name="contact">rs@space.dtu.dk</metadata><metadata xmlns="http://www.met.no/schema/metamod/MM2" name="topiccategory">oceans</metadata><metadata xmlns="http://www.met.no/schema/metamod/MM2" name="PI_name">Roberto Saldo</metadata><metadata xmlns="http://www.met.no/schema/metamod/MM2" name="keywords">Ice</metadata><metadata xmlns="http://www.met.no/schema/metamod/MM2" name="activity_type">Space borne instrument</metadata><metadata xmlns="http://www.met.no/schema/metamod/MM2" name="project_name">DAMOCLES</metadata><metadata xmlns="http://www.met.no/schema/metamod/MM2" name="Conventions">CF-1.0</metadata><metadata xmlns="http://www.met.no/schema/metamod/MM2" name="history">2006-08-24 creation</metadata><metadata xmlns="http://www.met.no/schema/metamod/MM2" name="distribution_statement">Free</metadata><metadata xmlns="http://www.met.no/schema/metamod/MM2" name="abstract">Envisat ASAR GMM derived 3 day ice movement </metadata><metadata xmlns="http://www.met.no/schema/metamod/MM2" name="title">GMM ice movement</metadata><metadata xmlns="http://www.met.no/schema/metamod/MM2" name="product_name">GMM icemovement</metadata><metadata xmlns="http://www.met.no/schema/metamod/MM2" name="dataref">http://damocles.met.no:8080/thredds/catalog/data/DTU/gmmicemov/catalog.html?dataset=DTU/gmmicemov/gmmicemov_20060821-20060824.nc</metadata><metadata xmlns="http://www.met.no/schema/metamod/MM2" name="institution">DTU Technical University of Denmark</metadata></MM2>
