<?xml version="1.0" encoding="iso8859-1"?>
<MM2 xmlns="http://www.met.no/schema/metamod/MM2" xmlns:xsi="http://www.w3.org/2001/XMLSchema-instance" xsi:schemaLocation="http://www.met.no/schema/metamod/MM2 https://wiki.met.no/_media/metamod/mm2.xsd">
<metadata xmlns="http://www.met.no/schema/metamod/MM2" name="variable">global_radiation</metadata><metadata xmlns="http://www.met.no/schema/metamod/MM2" name="variable">relative_humidity</metadata><metadata xmlns="http://www.met.no/schema/metamod/MM2" name="variable">cloud_base_altitude</metadata><metadata xmlns="http://www.met.no/schema/metamod/MM2" name="variable">visibility_in_air</metadata><metadata xmlns="http://www.met.no/schema/metamod/MM2" name="variable">air_pressure</metadata><metadata xmlns="http://www.met.no/schema/metamod/MM2" name="variable">wind_from_direction</metadata><metadata xmlns="http://www.met.no/schema/metamod/MM2" name="variable">dew_point_temperature</metadata><metadata xmlns="http://www.met.no/schema/metamod/MM2" name="variable">air_temperature</metadata><metadata xmlns="http://www.met.no/schema/metamod/MM2" name="variable">wind_speed</metadata><metadata xmlns="http://www.met.no/schema/metamod/MM2" name="area">Arctic Ocean</metadata><metadata xmlns="http://www.met.no/schema/metamod/MM2" name="contact">christof.luepkes@awi.de</metadata><metadata xmlns="http://www.met.no/schema/metamod/MM2" name="topiccategory">climatologyMeteorologyAtmosphere</metadata><metadata xmlns="http://www.met.no/schema/metamod/MM2" name="PI_name">Christof Lüpkes</metadata><metadata xmlns="http://www.met.no/schema/metamod/MM2" name="product_version">1.0</metadata><metadata xmlns="http://www.met.no/schema/metamod/MM2" name="keywords">arctic soundings</metadata><metadata xmlns="http://www.met.no/schema/metamod/MM2" name="keywords">arctic boundary layer</metadata><metadata xmlns="http://www.met.no/schema/metamod/MM2" name="references">Damocles deliverables 2.2-05 and 2.3-04 by Lüpkes et al. and http://dship.awi.de/</metadata><metadata xmlns="http://www.met.no/schema/metamod/MM2" name="datacollection_period_from">2007-08-01</metadata><metadata xmlns="http://www.met.no/schema/metamod/MM2" name="activity_type">Cruise</metadata><metadata xmlns="http://www.met.no/schema/metamod/MM2" name="project_name">DAMOCLES</metadata><metadata xmlns="http://www.met.no/schema/metamod/MM2" name="Conventions">CF-1.0</metadata><metadata xmlns="http://www.met.no/schema/metamod/MM2" name="history">2009-01-22 creation</metadata><metadata xmlns="http://www.met.no/schema/metamod/MM2" name="distribution_statement">Restricted to Damocles</metadata><metadata xmlns="http://www.met.no/schema/metamod/MM2" name="quality_index">2</metadata><metadata xmlns="http://www.met.no/schema/metamod/MM2" name="datacollection_period_to">2007-09-30</metadata><metadata xmlns="http://www.met.no/schema/metamod/MM2" name="abstract">meteorological observations from Polarstern cruise ARKXXII/2 to the central 
Arctic Ocean. </metadata><metadata xmlns="http://www.met.no/schema/metamod/MM2" name="title">ark22_2 met_soundings</metadata><metadata xmlns="http://www.met.no/schema/metamod/MM2" name="bounding_box">180,78,-180,89</metadata><metadata xmlns="http://www.met.no/schema/metamod/MM2" name="institution">AWI Alfred Wegener Institute for Polar and Marine Research</metadata><metadata xmlns="http://www.met.no/schema/metamod/MM2" name="product_name">ark22-2-met_polarstern-soundings.nc</metadata><metadata xmlns="http://www.met.no/schema/metamod/MM2" name="dataref">http://thredds.met.no/thredds/catalog/data/AWI/ark22-2-met/</metadata></MM2>
